[
  {
    "source_id": "SRC-IND-001",
    "title": "Pāṇilekhā: An Early Indian Formulation of Palmistry",
    "author": "Kenneth G. Zysk (Ed. and Trans.)",
    "publication_year": 2020,
    "language": "sa/en",
    "tradition": "CLASSICAL_INDIAN",
    "source_type": "SCHOLARLY_CRITICAL_EDITION",
    "authority_level": "LEVEL_1",
    "license": "ACADEMIC_COPYRIGHT",
    "rights_status": "STRUCTURED_FACT_EXTRACTION_PERMITTED",
    "url": "https://doi.org/10.1163/15728536-06303001",
    "edition": "Indo-Iranian Journal 63 (2020) 201–248",
    "notes": "Critical edition and study of the Pāṇilekhā chapter of the Śārdūlakarṇāvadāna."
  },
  {
    "source_id": "SRC-IND-002",
    "title": "Bṛhat Saṃhitā",
    "author": "Varāhamihira",
    "publication_year": 550,
    "language": "sa",
    "tradition": "CLASSICAL_INDIAN",
    "source_type": "PRIMARY_HISTORICAL_TEXT",
    "authority_level": "LEVEL_1",
    "license": "PUBLIC_DOMAIN",
    "rights_status": "PUBLIC_DOMAIN_WORLDWIDE",
    "url": "https://archive.org/details/brihatsamhita00varauoft",
    "edition": "Chapters on Puruṣa-lakṣaṇa and Pāṇi-lakṣaṇa",
    "notes": "Primary classical compendium detailing bodily marks and hand signs."
  },
  {
    "source_id": "SRC-IND-003",
    "title": "Hastasañjīvana",
    "author": "Meghavijaya Gaṇi",
    "publication_year": 1680,
    "language": "sa",
    "tradition": "CLASSICAL_INDIAN",
    "source_type": "PRIMARY_HISTORICAL_TEXT",
    "authority_level": "LEVEL_1",
    "license": "PUBLIC_DOMAIN",
    "rights_status": "PUBLIC_DOMAIN_WORLDWIDE",
    "url": "https://archive.org/details/hastasañjivana",
    "edition": "Western Indian Classical Palmistry Treatise",
    "notes": "Medieval Sanskrit manual detailing line intersections and planetary mount traits."
  },
  {
    "source_id": "SRC-IND-101",
    "title": "Practical Palmistry (Hastarekha Vigyan)",
    "author": "Dr. Narayan Dutt Shrimali",
    "publication_year": 1985,
    "language": "hi/en",
    "tradition": "MODERN_INDIAN",
    "source_type": "MODERN_REFERENCE",
    "authority_level": "LEVEL_4",
    "license": "COPYRIGHTED",
    "rights_status": "FACTUAL_EXTRACTION_ONLY",
    "url": "https://pustakmahal.com",
    "edition": "Pustak Mahal (Revised 2002)",
    "notes": "Modern Indian manual applying traditional Samudrika to modern vocational topics."
  },
  {
    "source_id": "SRC-WST-001",
    "title": "The Laws of Scientific Hand Reading",
    "author": "William G. Benham",
    "publication_year": 1901,
    "language": "en",
    "tradition": "WESTERN_HISTORICAL",
    "source_type": "HISTORICAL_BOOK",
    "authority_level": "LEVEL_3",
    "license": "PUBLIC_DOMAIN",
    "rights_status": "PUBLIC_DOMAIN_WORLDWIDE",
    "url": "https://archive.org/details/lawsofscientifi00benh",
    "edition": "G.P. Putnam's Sons, New York / London, 635 pp.",
    "notes": "Definitive 20th-century historical treatise on hand morphology, mounts, and lines."
  },
  {
    "source_id": "SRC-WST-002",
    "title": "Palmistry for All",
    "author": "Cheiro (Count Louis Hamon)",
    "publication_year": 1916,
    "language": "en",
    "tradition": "WESTERN_HISTORICAL",
    "source_type": "HISTORICAL_BOOK",
    "authority_level": "LEVEL_3",
    "license": "PUBLIC_DOMAIN",
    "rights_status": "PUBLIC_DOMAIN_WORLDWIDE",
    "url": "https://archive.org/details/palmistryforall00chei",
    "edition": "Herbert Jenkins Ltd., London",
    "notes": "Concise historical guide to the major lines, hand shapes, and mounts."
  }
]
